/tmp/pjdfstest-run/tests/chflags/00.t .......... ok
/tmp/pjdfstest-run/tests/chflags/01.t .......... ok
/tmp/pjdfstest-run/tests/chflags/02.t .......... ok
/tmp/pjdfstest-run/tests/chflags/03.t .......... ok
/tmp/pjdfstest-run/tests/chflags/04.t .......... ok
/tmp/pjdfstest-run/tests/chflags/05.t .......... ok
/tmp/pjdfstest-run/tests/chflags/06.t .......... ok
/tmp/pjdfstest-run/tests/chflags/07.t .......... ok
/tmp/pjdfstest-run/tests/chflags/08.t .......... ok
/tmp/pjdfstest-run/tests/chflags/09.t .......... ok
/tmp/pjdfstest-run/tests/chflags/10.t .......... ok
/tmp/pjdfstest-run/tests/chflags/11.t .......... ok
/tmp/pjdfstest-run/tests/chflags/12.t .......... ok
/tmp/pjdfstest-run/tests/chflags/13.t .......... ok
lstat returned -1
lstat returned -1
lstat returned -1
lstat returned -1
lstat returned -1
stat returned -1
stat returned -1
stat returned -1
stat returned -1
stat returned -1
stat returned -1
stat returned -1
stat returned -1
stat returned -1
stat returned -1
stat returned -1
stat returned -1
stat returned -1
stat returned -1
stat returned -1
stat returned -1
stat returned -1
stat returned -1
stat returned -1
stat returned -1
stat returned -1
stat returned -1
stat returned -1
stat returned -1
/tmp/pjdfstest-run/tests/chmod/00.t ............ 
Failed 102/119 subtests 
/tmp/pjdfstest-run/tests/chmod/01.t ............ 
Failed 12/17 subtests 
/tmp/pjdfstest-run/tests/chmod/02.t ............ ok
/tmp/pjdfstest-run/tests/chmod/03.t ............ 
Failed 4/5 subtests 
/tmp/pjdfstest-run/tests/chmod/04.t ............ ok
/tmp/pjdfstest-run/tests/chmod/05.t ............ ok
/tmp/pjdfstest-run/tests/chmod/06.t ............ ok
/tmp/pjdfstest-run/tests/chmod/07.t ............ 
Failed 11/25 subtests 
/tmp/pjdfstest-run/tests/chmod/08.t ............ ok
/tmp/pjdfstest-run/tests/chmod/09.t ............ ok
/tmp/pjdfstest-run/tests/chmod/10.t ............ ok
/tmp/pjdfstest-run/tests/chmod/11.t ............ 
Failed 99/109 subtests 
/tmp/pjdfstest-run/tests/chmod/12.t ............ 
Failed 10/14 subtests 
lstat returned -1
lstat returned -1
lstat returned -1
lstat returned -1
lstat returned -1
lstat returned -1
lstat returned -1
lstat returned -1
lstat returned -1
lstat returned -1
lstat returned -1
stat returned -1
stat returned -1
stat returned -1
stat returned -1
stat returned -1
stat returned -1
stat returned -1
stat returned -1
lstat returned -1
lstat returned -1
lstat returned -1
lstat returned -1
stat returned -1
stat returned -1
stat returned -1
stat returned -1
stat returned -1
stat returned -1
stat returned -1
stat returned -1
lstat returned -1
lstat returned -1
lstat returned -1
lstat returned -1
stat returned -1
stat returned -1
stat returned -1
stat returned -1
stat returned -1
stat returned -1
stat returned -1
stat returned -1
lstat returned -1
lstat returned -1
lstat returned -1
lstat returned -1
stat returned -1
stat returned -1
stat returned -1
stat returned -1
stat returned -1
stat returned -1
stat returned -1
stat returned -1
lstat returned -1
lstat returned -1
lstat returned -1
lstat returned -1
stat returned -1
stat returned -1
stat returned -1
stat returned -1
stat returned -1
stat returned -1
stat returned -1
stat returned -1
lstat returned -1
lstat returned -1
lstat returned -1
lstat returned -1
stat returned -1
stat returned -1
stat returned -1
stat returned -1
stat returned -1
stat returned -1
stat returned -1
stat returned -1
lstat returned -1
lstat returned -1
lstat returned -1
lstat returned -1
lstat returned -1
lstat returned -1
lstat returned -1
lstat returned -1
stat returned -1
stat returned -1
stat returned -1
stat returned -1
lstat returned -1
lstat returned -1
stat returned -1
stat returned -1
stat returned -1
stat returned -1
lstat returned -1
lstat returned -1
stat returned -1
stat returned -1
stat returned -1
stat returned -1
lstat returned -1
lstat returned -1
stat returned -1
stat returned -1
stat returned -1
stat returned -1
lstat returned -1
lstat returned -1
stat returned -1
stat returned -1
stat returned -1
stat returned -1
lstat returned -1
lstat returned -1
stat returned -1
stat returned -1
stat returned -1
stat returned -1
lstat returned -1
lstat returned -1
lstat returned -1
lstat returned -1
stat returned -1
stat returned -1
stat returned -1
stat returned -1
lstat returned -1
lstat returned -1
stat returned -1
stat returned -1
stat returned -1
stat returned -1
lstat returned -1
lstat returned -1
stat returned -1
stat returned -1
stat returned -1
stat returned -1
lstat returned -1
lstat returned -1
stat returned -1
stat returned -1
stat returned -1
stat returned -1
lstat returned -1
lstat returned -1
stat returned -1
stat returned -1
stat returned -1
stat returned -1
lstat returned -1
lstat returned -1
stat returned -1
stat returned -1
stat returned -1
stat returned -1
lstat returned -1
lstat returned -1
lstat returned -1
lstat returned -1
/tmp/pjdfstest-run/tests/chown/00.t ............ 
Failed 1216/1280 subtests 
/tmp/pjdfstest-run/tests/chown/01.t ............ 
Failed 16/22 subtests 
/tmp/pjdfstest-run/tests/chown/02.t ............ 
Failed 4/10 subtests 
/tmp/pjdfstest-run/tests/chown/03.t ............ 
Failed 8/10 subtests 
/tmp/pjdfstest-run/tests/chown/04.t ............ ok
/tmp/pjdfstest-run/tests/chown/05.t ............ ok
/tmp/pjdfstest-run/tests/chown/06.t ............ ok
/tmp/pjdfstest-run/tests/chown/07.t ............ 
Failed 122/132 subtests 
/tmp/pjdfstest-run/tests/chown/08.t ............ ok
/tmp/pjdfstest-run/tests/chown/09.t ............ ok
/tmp/pjdfstest-run/tests/chown/10.t ............ ok
stat returned -1
stat returned -1
stat returned -1
stat returned -1
/tmp/pjdfstest-run/tests/ftruncate/00.t ........ 
Failed 17/26 subtests 
/tmp/pjdfstest-run/tests/ftruncate/01.t ........ ok
/tmp/pjdfstest-run/tests/ftruncate/02.t ........ ok
/tmp/pjdfstest-run/tests/ftruncate/03.t ........ 
Failed 4/5 subtests 
/tmp/pjdfstest-run/tests/ftruncate/04.t ........ ok
/tmp/pjdfstest-run/tests/ftruncate/05.t ........ ok
/tmp/pjdfstest-run/tests/ftruncate/06.t ........ ok
/tmp/pjdfstest-run/tests/ftruncate/07.t ........ ok
/tmp/pjdfstest-run/tests/ftruncate/08.t ........ ok
/tmp/pjdfstest-run/tests/ftruncate/09.t ........ ok
/tmp/pjdfstest-run/tests/ftruncate/10.t ........ ok
/tmp/pjdfstest-run/tests/ftruncate/11.t ........ ok
/tmp/pjdfstest-run/tests/ftruncate/12.t ........ ok
/tmp/pjdfstest-run/tests/ftruncate/13.t ........ ok
/tmp/pjdfstest-run/tests/ftruncate/14.t ........ ok
/tmp/pjdfstest-run/tests/granular/00.t ......... ok
/tmp/pjdfstest-run/tests/granular/01.t ......... ok
/tmp/pjdfstest-run/tests/granular/02.t ......... ok
/tmp/pjdfstest-run/tests/granular/03.t ......... ok
/tmp/pjdfstest-run/tests/granular/04.t ......... ok
/tmp/pjdfstest-run/tests/granular/05.t ......... ok
/tmp/pjdfstest-run/tests/granular/06.t ......... ok
stat returned -1
stat returned -1
stat returned -1
stat returned -1
stat returned -1
stat returned -1
stat returned -1
stat returned -1
stat returned -1
stat returned -1
stat returned -1
stat returned -1
stat returned -1
stat returned -1
stat returned -1
stat returned -1
stat returned -1
stat returned -1
stat returned -1
stat returned -1
/tmp/pjdfstest-run/tests/link/00.t ............. 
Failed 140/202 subtests 
/tmp/pjdfstest-run/tests/link/01.t ............. 
Failed 24/32 subtests 
/tmp/pjdfstest-run/tests/link/02.t ............. ok
/tmp/pjdfstest-run/tests/link/03.t ............. 
Failed 12/13 subtests 
/tmp/pjdfstest-run/tests/link/04.t ............. ok
/tmp/pjdfstest-run/tests/link/05.t ............. ok
/tmp/pjdfstest-run/tests/link/06.t ............. ok
/tmp/pjdfstest-run/tests/link/07.t ............. ok
/tmp/pjdfstest-run/tests/link/08.t ............. ok
/tmp/pjdfstest-run/tests/link/09.t ............. ok
/tmp/pjdfstest-run/tests/link/10.t ............. 
Failed 12/23 subtests 
/tmp/pjdfstest-run/tests/link/11.t ............. ok
/tmp/pjdfstest-run/tests/link/12.t ............. ok
/tmp/pjdfstest-run/tests/link/13.t ............. ok
/tmp/pjdfstest-run/tests/link/14.t ............. ok
/tmp/pjdfstest-run/tests/link/15.t ............. ok
/tmp/pjdfstest-run/tests/link/16.t ............. ok
/tmp/pjdfstest-run/tests/link/17.t ............. ok
/tmp/pjdfstest-run/tests/mkdir/00.t ............ ok
/tmp/pjdfstest-run/tests/mkdir/01.t ............ 
Failed 12/17 subtests 
/tmp/pjdfstest-run/tests/mkdir/02.t ............ ok
/tmp/pjdfstest-run/tests/mkdir/03.t ............ ok
/tmp/pjdfstest-run/tests/mkdir/04.t ............ ok
/tmp/pjdfstest-run/tests/mkdir/05.t ............ ok
/tmp/pjdfstest-run/tests/mkdir/06.t ............ ok
/tmp/pjdfstest-run/tests/mkdir/07.t ............ ok
/tmp/pjdfstest-run/tests/mkdir/08.t ............ ok
/tmp/pjdfstest-run/tests/mkdir/09.t ............ ok
/tmp/pjdfstest-run/tests/mkdir/10.t ............ 
Failed 12/21 subtests 
/tmp/pjdfstest-run/tests/mkdir/11.t ............ ok
/tmp/pjdfstest-run/tests/mkdir/12.t ............ ok
stat returned -1
stat returned -1
stat returned -1
/tmp/pjdfstest-run/tests/mkfifo/00.t ........... 
Failed 28/36 subtests 
/tmp/pjdfstest-run/tests/mkfifo/01.t ........... 
Failed 12/17 subtests 
/tmp/pjdfstest-run/tests/mkfifo/02.t ........... ok
/tmp/pjdfstest-run/tests/mkfifo/03.t ........... ok
/tmp/pjdfstest-run/tests/mkfifo/04.t ........... ok
/tmp/pjdfstest-run/tests/mkfifo/05.t ........... 
Failed 2/12 subtests 
/tmp/pjdfstest-run/tests/mkfifo/06.t ........... 
Failed 2/12 subtests 
/tmp/pjdfstest-run/tests/mkfifo/07.t ........... ok
/tmp/pjdfstest-run/tests/mkfifo/08.t ........... ok
/tmp/pjdfstest-run/tests/mkfifo/09.t ........... 
Failed 12/21 subtests 
/tmp/pjdfstest-run/tests/mkfifo/10.t ........... ok
/tmp/pjdfstest-run/tests/mkfifo/11.t ........... ok
/tmp/pjdfstest-run/tests/mkfifo/12.t ........... ok
stat returned -1
stat returned -1
stat returned -1
/tmp/pjdfstest-run/tests/mknod/00.t ............ 
Failed 28/36 subtests 
/tmp/pjdfstest-run/tests/mknod/01.t ............ 
Failed 20/27 subtests 
/tmp/pjdfstest-run/tests/mknod/02.t ............ 
Failed 6/12 subtests 
/tmp/pjdfstest-run/tests/mknod/03.t ............ 
Failed 6/12 subtests 
/tmp/pjdfstest-run/tests/mknod/04.t ............ ok
/tmp/pjdfstest-run/tests/mknod/05.t ............ 
Failed 2/12 subtests 
/tmp/pjdfstest-run/tests/mknod/06.t ............ 
Failed 2/12 subtests 
/tmp/pjdfstest-run/tests/mknod/07.t ............ ok
/tmp/pjdfstest-run/tests/mknod/08.t ............ 
Failed 12/35 subtests 
/tmp/pjdfstest-run/tests/mknod/09.t ............ ok
/tmp/pjdfstest-run/tests/mknod/10.t ............ ok
stat returned -1
stat returned -1
stat returned -1
stat returned -1
stat returned -1
stat returned -1
/tmp/pjdfstest-run/tests/mknod/11.t ............ 
Failed 18/28 subtests 
stat returned -1
stat returned -1
stat returned -1
/tmp/pjdfstest-run/tests/open/00.t: 85: cannot create pjdfstest_bb6243f7da371c07d5774c1ff06a969e: File exists
stat returned -1
stat returned -1
stat returned -1
stat returned -1
/tmp/pjdfstest-run/tests/open/00.t ............. 
Failed 37/47 subtests 
/tmp/pjdfstest-run/tests/open/01.t ............. 
Failed 16/22 subtests 
/tmp/pjdfstest-run/tests/open/02.t ............. ok
/tmp/pjdfstest-run/tests/open/03.t ............. 
Failed 3/4 subtests 
/tmp/pjdfstest-run/tests/open/04.t ............. ok
/tmp/pjdfstest-run/tests/open/05.t ............. ok
/tmp/pjdfstest-run/tests/open/06.t ............. 
Failed 79/144 subtests 
/tmp/pjdfstest-run/tests/open/07.t ............. ok
/tmp/pjdfstest-run/tests/open/08.t ............. ok
/tmp/pjdfstest-run/tests/open/09.t ............. ok
/tmp/pjdfstest-run/tests/open/10.t ............. ok
/tmp/pjdfstest-run/tests/open/11.t ............. ok
/tmp/pjdfstest-run/tests/open/12.t ............. ok
/tmp/pjdfstest-run/tests/open/13.t ............. ok
/tmp/pjdfstest-run/tests/open/14.t ............. ok
/tmp/pjdfstest-run/tests/open/15.t ............. ok
/tmp/pjdfstest-run/tests/open/16.t ............. ok
/tmp/pjdfstest-run/tests/open/17.t ............. ok
/tmp/pjdfstest-run/tests/open/18.t ............. ok
/tmp/pjdfstest-run/tests/open/19.t ............. ok
/tmp/pjdfstest-run/tests/open/20.t ............. ok
/tmp/pjdfstest-run/tests/open/21.t ............. ok
/tmp/pjdfstest-run/tests/open/22.t ............. 
Failed 12/21 subtests 
/tmp/pjdfstest-run/tests/open/23.t ............. ok
/tmp/pjdfstest-run/tests/open/24.t ............. ok
/tmp/pjdfstest-run/tests/open/25.t ............. ok
/tmp/pjdfstest-run/tests/posix_fallocate/00.t .. ok
lstat returned -1
lstat returned -1
lstat returned -1
lstat returned -1
lstat returned -1
lstat returned -1
lstat returned -1
lstat returned -1
/tmp/pjdfstest-run/tests/rename/00.t ........... 
Failed 51/122 subtests 
/tmp/pjdfstest-run/tests/rename/01.t ........... ok
/tmp/pjdfstest-run/tests/rename/02.t ........... ok
/tmp/pjdfstest-run/tests/rename/03.t ........... ok
/tmp/pjdfstest-run/tests/rename/04.t ........... ok
/tmp/pjdfstest-run/tests/rename/05.t ........... ok
/tmp/pjdfstest-run/tests/rename/06.t ........... ok
/tmp/pjdfstest-run/tests/rename/07.t ........... ok
/tmp/pjdfstest-run/tests/rename/08.t ........... ok
lstat returned -1
lstat returned -1
lstat returned -1
lstat returned -1
lstat returned -1
lstat returned -1
lstat returned -1
lstat returned -1
lstat returned -1
lstat returned -1
lstat returned -1
lstat returned -1
lstat returned -1
lstat returned -1
lstat returned -1
lstat returned -1
lstat returned -1
lstat returned -1
lstat returned -1
lstat returned -1
lstat returned -1
lstat returned -1
lstat returned -1
lstat returned -1
lstat returned -1
lstat returned -1
lstat returned -1
lstat returned -1
lstat returned -1
lstat returned -1
lstat returned -1
lstat returned -1
lstat returned -1
lstat returned -1
lstat returned -1
lstat returned -1
lstat returned -1
lstat returned -1
lstat returned -1
lstat returned -1
lstat returned -1
lstat returned -1
lstat returned -1
lstat returned -1
lstat returned -1
lstat returned -1
lstat returned -1
lstat returned -1
/tmp/pjdfstest-run/tests/rename/09.t ........... 
Failed 1610/2353 subtests 
lstat returned -1
lstat returned -1
lstat returned -1
lstat returned -1
lstat returned -1
lstat returned -1
lstat returned -1
lstat returned -1
lstat returned -1
lstat returned -1
lstat returned -1
lstat returned -1
lstat returned -1
lstat returned -1
lstat returned -1
lstat returned -1
lstat returned -1
lstat returned -1
lstat returned -1
lstat returned -1
lstat returned -1
lstat returned -1
lstat returned -1
lstat returned -1
lstat returned -1
lstat returned -1
lstat returned -1
lstat returned -1
lstat returned -1
lstat returned -1
lstat returned -1
lstat returned -1
lstat returned -1
lstat returned -1
lstat returned -1
lstat returned -1
lstat returned -1
lstat returned -1
lstat returned -1
lstat returned -1
lstat returned -1
lstat returned -1
lstat returned -1
lstat returned -1
lstat returned -1
lstat returned -1
lstat returned -1
lstat returned -1
/tmp/pjdfstest-run/tests/rename/10.t ........... 
Failed 1231/2099 subtests 
/tmp/pjdfstest-run/tests/rename/11.t ........... ok
/tmp/pjdfstest-run/tests/rename/12.t ........... 
Failed 24/32 subtests 
/tmp/pjdfstest-run/tests/rename/13.t ........... 
Failed 20/32 subtests 
/tmp/pjdfstest-run/tests/rename/14.t ........... 
Failed 20/32 subtests 
/tmp/pjdfstest-run/tests/rename/15.t ........... ok
/tmp/pjdfstest-run/tests/rename/16.t ........... ok
/tmp/pjdfstest-run/tests/rename/17.t ........... ok
/tmp/pjdfstest-run/tests/rename/18.t ........... ok
/tmp/pjdfstest-run/tests/rename/19.t ........... ok
/tmp/pjdfstest-run/tests/rename/20.t ........... 
Failed 12/25 subtests 
/tmp/pjdfstest-run/tests/rename/21.t ........... ok
/tmp/pjdfstest-run/tests/rename/22.t ........... ok
lstat returned -1
lstat returned -1
lstat returned -1
lstat returned -1
lstat returned -1
lstat returned -1
lstat returned -1
lstat returned -1
/tmp/pjdfstest-run/tests/rename/23.t ........... 
Failed 36/42 subtests 
/tmp/pjdfstest-run/tests/rename/24.t ........... 
Failed 2/13 subtests 
/tmp/pjdfstest-run/tests/rmdir/00.t ............ ok
/tmp/pjdfstest-run/tests/rmdir/01.t ............ 
Failed 6/14 subtests 
/tmp/pjdfstest-run/tests/rmdir/02.t ............ ok
/tmp/pjdfstest-run/tests/rmdir/03.t ............ ok
/tmp/pjdfstest-run/tests/rmdir/04.t ............ ok
/tmp/pjdfstest-run/tests/rmdir/05.t ............ ok
/tmp/pjdfstest-run/tests/rmdir/06.t ............ 
Failed 19/23 subtests 
/tmp/pjdfstest-run/tests/rmdir/07.t ............ ok
/tmp/pjdfstest-run/tests/rmdir/08.t ............ ok
/tmp/pjdfstest-run/tests/rmdir/09.t ............ ok
/tmp/pjdfstest-run/tests/rmdir/10.t ............ ok
/tmp/pjdfstest-run/tests/rmdir/11.t ............ ok
/tmp/pjdfstest-run/tests/rmdir/12.t ............ ok
/tmp/pjdfstest-run/tests/rmdir/13.t ............ ok
/tmp/pjdfstest-run/tests/rmdir/14.t ............ ok
/tmp/pjdfstest-run/tests/rmdir/15.t ............ ok
stat returned -1
stat returned -1
stat returned -1
/tmp/pjdfstest-run/tests/symlink/00.t .......... 
Failed 6/14 subtests 
/tmp/pjdfstest-run/tests/symlink/01.t .......... ok
/tmp/pjdfstest-run/tests/symlink/02.t .......... ok
/tmp/pjdfstest-run/tests/symlink/03.t .......... ok
/tmp/pjdfstest-run/tests/symlink/04.t .......... ok
/tmp/pjdfstest-run/tests/symlink/05.t .......... 
Failed 2/12 subtests 
/tmp/pjdfstest-run/tests/symlink/06.t .......... 
Failed 2/12 subtests 
/tmp/pjdfstest-run/tests/symlink/07.t .......... ok
/tmp/pjdfstest-run/tests/symlink/08.t .......... 
Failed 12/21 subtests 
/tmp/pjdfstest-run/tests/symlink/09.t .......... ok
/tmp/pjdfstest-run/tests/symlink/10.t .......... ok
/tmp/pjdfstest-run/tests/symlink/11.t .......... ok
/tmp/pjdfstest-run/tests/symlink/12.t .......... ok
stat returned -1
stat returned -1
stat returned -1
stat returned -1
/tmp/pjdfstest-run/tests/truncate/00.t ......... 
Failed 13/21 subtests 
/tmp/pjdfstest-run/tests/truncate/01.t ......... ok
/tmp/pjdfstest-run/tests/truncate/02.t ......... ok
/tmp/pjdfstest-run/tests/truncate/03.t ......... 
Failed 4/5 subtests 
/tmp/pjdfstest-run/tests/truncate/04.t ......... ok
/tmp/pjdfstest-run/tests/truncate/05.t ......... ok
/tmp/pjdfstest-run/tests/truncate/06.t ......... ok
/tmp/pjdfstest-run/tests/truncate/07.t ......... ok
/tmp/pjdfstest-run/tests/truncate/08.t ......... ok
/tmp/pjdfstest-run/tests/truncate/09.t ......... ok
/tmp/pjdfstest-run/tests/truncate/10.t ......... ok
/tmp/pjdfstest-run/tests/truncate/11.t ......... ok
/tmp/pjdfstest-run/tests/truncate/12.t ......... ok
/tmp/pjdfstest-run/tests/truncate/13.t ......... ok
/tmp/pjdfstest-run/tests/truncate/14.t ......... ok
stat returned -1
stat returned -1
stat returned -1
stat returned -1
stat returned -1
stat returned -1
stat returned -1
stat returned -1
stat returned -1
stat returned -1
stat returned -1
stat returned -1
stat returned -1
stat returned -1
stat returned -1
stat returned -1
stat returned -1
stat returned -1
stat returned -1
stat returned -1
stat returned -1
stat returned -1
stat returned -1
stat returned -1
stat returned -1
stat returned -1
stat returned -1
stat returned -1
stat returned -1
stat returned -1
stat returned -1
stat returned -1
stat returned -1
stat returned -1
stat returned -1
stat returned -1
stat returned -1
stat returned -1
stat returned -1
stat returned -1
/tmp/pjdfstest-run/tests/unlink/00.t ........... 
Failed 101/112 subtests 
/tmp/pjdfstest-run/tests/unlink/01.t ........... ok
/tmp/pjdfstest-run/tests/unlink/02.t ........... ok
/tmp/pjdfstest-run/tests/unlink/03.t ........... 
Failed 2/4 subtests 
/tmp/pjdfstest-run/tests/unlink/04.t ........... ok
/tmp/pjdfstest-run/tests/unlink/05.t ........... ok
/tmp/pjdfstest-run/tests/unlink/06.t ........... ok
/tmp/pjdfstest-run/tests/unlink/07.t ........... ok
/tmp/pjdfstest-run/tests/unlink/08.t ........... ok
/tmp/pjdfstest-run/tests/unlink/09.t ........... ok
/tmp/pjdfstest-run/tests/unlink/10.t ........... ok
/tmp/pjdfstest-run/tests/unlink/11.t ........... 
Failed 188/270 subtests 
/tmp/pjdfstest-run/tests/unlink/12.t ........... ok
/tmp/pjdfstest-run/tests/unlink/13.t ........... ok
/tmp/pjdfstest-run/tests/unlink/14.t ........... 
Failed 1/7 subtests 
/tmp/pjdfstest-run/tests/utimensat/00.t ........ 
Failed 25/32 subtests 
/tmp/pjdfstest-run/tests/utimensat/01.t ........ ok
/tmp/pjdfstest-run/tests/utimensat/02.t ........ ok
/tmp/pjdfstest-run/tests/utimensat/03.t ........ ok
/tmp/pjdfstest-run/tests/utimensat/04.t ........ ok
/tmp/pjdfstest-run/tests/utimensat/05.t ........ ok
/tmp/pjdfstest-run/tests/utimensat/06.t ........ ok
/tmp/pjdfstest-run/tests/utimensat/07.t ........ ok
/tmp/pjdfstest-run/tests/utimensat/08.t ........ ok
/tmp/pjdfstest-run/tests/utimensat/09.t ........ 
Failed 1/7 subtests 

Test Summary Report
-------------------
/tmp/pjdfstest-run/tests/chmod/00.t          (Wstat: 0 Tests: 119 Failed: 102)
  Failed tests:  12-18, 20-28, 30-38, 40-48, 50-58, 60-118
/tmp/pjdfstest-run/tests/chmod/01.t          (Wstat: 0 Tests: 17 Failed: 12)
  Failed tests:  5-16
/tmp/pjdfstest-run/tests/chmod/03.t          (Wstat: 0 Tests: 5 Failed: 4)
  Failed tests:  1-4
/tmp/pjdfstest-run/tests/chmod/07.t          (Wstat: 0 Tests: 25 Failed: 11)
  Failed tests:  7, 10, 13, 15-22
/tmp/pjdfstest-run/tests/chmod/11.t          (Wstat: 0 Tests: 109 Failed: 99)
  Failed tests:  10-108
/tmp/pjdfstest-run/tests/chmod/12.t          (Wstat: 0 Tests: 14 Failed: 10)
  Failed tests:  3-4, 6-13
/tmp/pjdfstest-run/tests/chown/00.t          (Wstat: 0 Tests: 1280 Failed: 1216)
  Failed tests:  14-26, 28-42, 44-58, 60-74, 76-90, 92-112
                114-116, 118-120, 122-142, 144-146, 148-150
                152-172, 174-176, 178-180, 182-202, 204-206
                208-210, 212-232, 234-236, 238-240, 242-262
                264-266, 268-270, 272-649, 651-653, 655-664
                667-670, 673-685, 687-689, 691-1053, 1055-1057
                1059-1063, 1065-1068, 1070-1072, 1074-1078
                1080-1083, 1085-1087, 1089-1093, 1095-1098
                1100-1102, 1104-1108, 1110-1113, 1115-1117
                1119-1123, 1125-1128, 1130-1132, 1134-1138
                1140-1143, 1145-1279
/tmp/pjdfstest-run/tests/chown/01.t          (Wstat: 0 Tests: 22 Failed: 16)
  Failed tests:  6-21
/tmp/pjdfstest-run/tests/chown/02.t          (Wstat: 0 Tests: 10 Failed: 4)
  Failed tests:  6-9
/tmp/pjdfstest-run/tests/chown/03.t          (Wstat: 0 Tests: 10 Failed: 8)
  Failed tests:  1-4, 6-9
/tmp/pjdfstest-run/tests/chown/07.t          (Wstat: 0 Tests: 132 Failed: 122)
  Failed tests:  6-9, 11-14, 17-130
/tmp/pjdfstest-run/tests/ftruncate/00.t      (Wstat: 0 Tests: 26 Failed: 17)
  Failed tests:  8-22, 24-25
/tmp/pjdfstest-run/tests/ftruncate/03.t      (Wstat: 0 Tests: 5 Failed: 4)
  Failed tests:  1-4
/tmp/pjdfstest-run/tests/link/00.t           (Wstat: 0 Tests: 202 Failed: 140)
  Failed tests:  28-42, 44-46, 48, 50, 54-68, 70-72, 74
                76, 80-94, 96-98, 100, 102, 106-120, 122-124
                126, 128, 132-170, 173-177, 180-184, 187-191
                194-198, 201
/tmp/pjdfstest-run/tests/link/01.t           (Wstat: 0 Tests: 32 Failed: 24)
  Failed tests:  8-31
/tmp/pjdfstest-run/tests/link/03.t           (Wstat: 0 Tests: 13 Failed: 12)
  Failed tests:  1-12
/tmp/pjdfstest-run/tests/link/10.t           (Wstat: 0 Tests: 23 Failed: 12)
  Failed tests:  5-8, 11-12, 14-15, 17-18, 20-21
/tmp/pjdfstest-run/tests/mkdir/01.t          (Wstat: 0 Tests: 17 Failed: 12)
  Failed tests:  5-16
/tmp/pjdfstest-run/tests/mkdir/10.t          (Wstat: 0 Tests: 21 Failed: 12)
  Failed tests:  4, 6-7, 9-10, 12-13, 15-16, 18-19, 21
/tmp/pjdfstest-run/tests/mkfifo/00.t         (Wstat: 0 Tests: 36 Failed: 28)
  Failed tests:  5-16, 18-23, 25-27, 29-35
/tmp/pjdfstest-run/tests/mkfifo/01.t         (Wstat: 0 Tests: 17 Failed: 12)
  Failed tests:  5-16
/tmp/pjdfstest-run/tests/mkfifo/05.t         (Wstat: 0 Tests: 12 Failed: 2)
  Failed tests:  9-10
/tmp/pjdfstest-run/tests/mkfifo/06.t         (Wstat: 0 Tests: 12 Failed: 2)
  Failed tests:  9-10
/tmp/pjdfstest-run/tests/mkfifo/09.t         (Wstat: 0 Tests: 21 Failed: 12)
  Failed tests:  4, 6-7, 9-10, 12-13, 15-16, 18-19, 21
/tmp/pjdfstest-run/tests/mknod/00.t          (Wstat: 0 Tests: 36 Failed: 28)
  Failed tests:  5-16, 18-23, 25-27, 29-35
/tmp/pjdfstest-run/tests/mknod/01.t          (Wstat: 0 Tests: 27 Failed: 20)
  Failed tests:  7-26
/tmp/pjdfstest-run/tests/mknod/02.t          (Wstat: 0 Tests: 12 Failed: 6)
  Failed tests:  5-7, 9-11
/tmp/pjdfstest-run/tests/mknod/03.t          (Wstat: 0 Tests: 12 Failed: 6)
  Failed tests:  5-7, 9-11
/tmp/pjdfstest-run/tests/mknod/05.t          (Wstat: 0 Tests: 12 Failed: 2)
  Failed tests:  9-10
/tmp/pjdfstest-run/tests/mknod/06.t          (Wstat: 0 Tests: 12 Failed: 2)
  Failed tests:  9-10
/tmp/pjdfstest-run/tests/mknod/08.t          (Wstat: 0 Tests: 35 Failed: 12)
  Failed tests:  6, 10-11, 15-16, 20-21, 25-26, 30-31, 35
/tmp/pjdfstest-run/tests/mknod/11.t          (Wstat: 0 Tests: 28 Failed: 18)
  Failed tests:  8-17, 19, 21-27
/tmp/pjdfstest-run/tests/open/00.t           (Wstat: 0 Tests: 47 Failed: 37)
  Failed tests:  5-16, 18-23, 25-27, 29-37, 40-46
/tmp/pjdfstest-run/tests/open/01.t           (Wstat: 0 Tests: 22 Failed: 16)
  Failed tests:  6-21
/tmp/pjdfstest-run/tests/open/03.t           (Wstat: 0 Tests: 4 Failed: 3)
  Failed tests:  1-3
/tmp/pjdfstest-run/tests/open/06.t           (Wstat: 0 Tests: 144 Failed: 79)
  Failed tests:  65-143
/tmp/pjdfstest-run/tests/open/22.t           (Wstat: 0 Tests: 21 Failed: 12)
  Failed tests:  4, 6-7, 9-10, 12-13, 15-16, 18-19, 21
/tmp/pjdfstest-run/tests/rename/00.t         (Wstat: 0 Tests: 122 Failed: 51)
  Failed tests:  11, 13-14, 16, 26, 28-29, 31, 41, 43-44
                46, 56, 58-59, 61, 71, 73-74, 76, 79-87
                89, 91-92, 94, 97-98, 106-121
/tmp/pjdfstest-run/tests/rename/09.t         (Wstat: 0 Tests: 2353 Failed: 1610)
  Failed tests:  66-68, 70-71, 76, 78-79, 81-82, 84, 86-87
                89-90, 92, 94-95, 97-98, 100, 102-103, 105-106
                108, 110-111, 113-114, 116, 118-119, 121-122
                124-126, 128-129, 131-132, 134, 136-137
                139-140, 142, 144-145, 147-148, 150, 152-153
                155-156, 158, 160-161, 163-164, 166, 168-169
                171-172, 174, 176-177, 179-180, 182-184
                186-187, 189-190, 192, 194-195, 197-198
                200, 202-203, 205-206, 208, 210-211, 213-214
                216, 218-219, 221-222, 224, 226-227, 229-230
                232, 234-235, 237-238, 240-242, 244-245
                247-248, 250, 252-253, 255-256, 258, 260-261
                263-264, 266, 268-269, 271-272, 274, 276-277
                279-280, 282, 284-285, 287-288, 290, 292-293
                295-296, 298-302, 304-305, 308-338, 340-380
                382-384, 386-387, 390-392, 394-395, 398-400
                402-403, 406-408, 410-411, 414-416, 418-419
                422-424, 426-427, 430-432, 434-435, 438
                440-442, 444-445, 448-450, 452-453, 456-458
                460-461, 464-466, 468-469, 472-474, 476-477
                480-482, 484-485, 488-490, 492-493, 496
                498-500, 502-503, 506-508, 510-511, 514-516
                518-519, 522-524, 526-527, 530-532, 534-535
                538-540, 542-543, 546-548, 550-551, 554
                556-558, 560-561, 564-566, 568-569, 572-574
                576-577, 580-582, 584-585, 588-590, 592-593
                596-598, 600-601, 604-606, 608-609, 612
                614-616, 618-619, 622-624, 626-627, 630-632
                634-635, 638-640, 642-643, 646-648, 650-651
                654-656, 658-659, 662-664, 666-667, 670
                672-712, 714-754, 756-758, 760-761, 764-766
                768-769, 772-774, 776-777, 780-782, 784-785
                788-790, 792-793, 796-798, 800-801, 804-806
                808-809, 812, 814-816, 818-819, 822-824
                826-827, 830-832, 834-835, 838-840, 842-843
                846-848, 850-851, 854-856, 858-859, 862-864
                866-867, 870, 872-874, 876-877, 880-882
                884-885, 888-890, 892-893, 896-898, 900-901
                904-906, 908-909, 912-914, 916-917, 920-922
                924-925, 928, 930-932, 934-935, 938-940
                942-943, 946-948, 950-951, 954-956, 958-959
                962-964, 966-967, 970-972, 974-975, 978-980
                982-983, 986, 988-990, 992-993, 996-998
                1000-1001, 1004-1006, 1008-1009, 1012-1014
                1016-1017, 1020-1022, 1024-1025, 1028-1030
                1032-1033, 1036-1038, 1040-1041, 1044, 1046-1086
                1088-1128, 1130-1132, 1134-1135, 1138-1140
                1142-1143, 1146-1148, 1150-1151, 1154-1156
                1158-1159, 1162-1164, 1166-1167, 1170-1172
                1174-1175, 1178-1180, 1182-1183, 1186, 1188-1190
                1192-1193, 1196-1198, 1200-1201, 1204-1206
                1208-1209, 1212-1214, 1216-1217, 1220-1222
                1224-1225, 1228-1230, 1232-1233, 1236-1238
                1240-1241, 1244, 1246-1248, 1250-1251, 1254-1256
                1258-1259, 1262-1264, 1266-1267, 1270-1272
                1274-1275, 1278-1280, 1282-1283, 1286-1288
                1290-1291, 1294-1296, 1298-1299, 1302, 1304-1306
                1308-1309, 1312-1314, 1316-1317, 1320-1322
                1324-1325, 1328-1330, 1332-1333, 1336-1338
                1340-1341, 1344-1346, 1348-1349, 1352-1354
                1356-1357, 1360, 1362-1364, 1366-1367, 1370-1372
                1374-1375, 1378-1380, 1382-1383, 1386-1388
                1390-1391, 1394-1396, 1398-1399, 1402-1404
                1406-1407, 1410-1412, 1414-1415, 1418, 1420-1460
                1462-1502, 1504-1506, 1508-1509, 1512-1514
                1516-1517, 1520-1522, 1524-1525, 1528-1530
                1532-1533, 1536-1538, 1540-1541, 1544-1546
                1548-1549, 1552-1554, 1556-1557, 1560, 1562-1564
                1566-1567, 1570-1572, 1574-1575, 1578-1580
                1582-1583, 1586-1588, 1590-1591, 1594-1596
                1598-1599, 1602-1604, 1606-1607, 1610-1612
                1614-1615, 1618, 1620-1622, 1624-1625, 1628-1630
                1632-1633, 1636-1638, 1640-1641, 1644-1646
                1648-1649, 1652-1654, 1656-1657, 1660-1662
                1664-1665, 1668-1670, 1672-1673, 1676, 1678-1680
                1682-1683, 1686-1688, 1690-1691, 1694-1696
                1698-1699, 1702-1704, 1706-1707, 1710-1712
                1714-1715, 1718-1720, 1722-1723, 1726-1728
                1730-1731, 1734, 1736-1738, 1740-1741, 1744-1746
                1748-1749, 1752-1754, 1756-1757, 1760-1762
                1764-1765, 1768-1770, 1772-1773, 1776-1778
                1780-1781, 1784-1786, 1788-1789, 1792, 1794-1834
                1836-1876, 1878-1880, 1882-1883, 1886-1888
                1890-1891, 1894-1896, 1898-1899, 1902-1904
                1906-1907, 1910-1912, 1914-1915, 1918-1920
                1922-1923, 1926-1928, 1930-1931, 1934, 1936-1938
                1940-1941, 1944-1946, 1948-1949, 1952-1954
                1956-1957, 1960-1962, 1964-1965, 1968-1970
                1972-1973, 1976-1978, 1980-1981, 1984-1986
                1988-1989, 1992, 1994-1996, 1998-1999, 2002-2004
                2006-2007, 2010-2012, 2014-2015, 2018-2020
                2022-2023, 2026-2028, 2030-2031, 2034-2036
                2038-2039, 2042-2044, 2046-2047, 2050, 2052-2054
                2056-2057, 2060-2062, 2064-2065, 2068-2070
                2072-2073, 2076-2078, 2080-2081, 2084-2086
                2088-2089, 2092-2094, 2096-2097, 2100-2102
                2104-2105, 2108, 2110-2112, 2114-2115, 2118-2120
                2122-2123, 2126-2128, 2130-2131, 2134-2136
                2138-2139, 2142-2144, 2146-2147, 2150-2152
                2154-2155, 2158-2160, 2162-2163, 2166, 2168-2208
                2210-2250, 2252-2254, 2256-2259, 2261-2262
                2264-2267, 2269, 2271-2277, 2279, 2281
                2284-2287, 2289, 2291-2297, 2299, 2301
                2304-2306, 2308-2311, 2313-2314, 2316-2318
                2320-2323, 2325-2326, 2328-2331, 2333-2338
                2340-2343, 2345-2350
/tmp/pjdfstest-run/tests/rename/10.t         (Wstat: 0 Tests: 2099 Failed: 1231)
  Failed tests:  59-60, 63, 65-66, 68-69, 71, 73-74, 76-77
                79, 81-82, 84-85, 87, 89-90, 92-93, 95
                97-98, 100-101, 103, 105-106, 108-109, 111-113
                115, 117-118, 120-121, 123, 125-126, 128-129
                131, 133-134, 136-137, 139, 141-142, 144-145
                147, 149-150, 152-153, 155, 157-158, 160-161
                163-165, 167, 169-170, 172-173, 175, 177-178
                180-181, 183, 185-186, 188-189, 191, 193-194
                196-197, 199, 201-202, 204-205, 207, 209-210
                212-213, 215-217, 219, 221-222, 224-225
                227, 229-230, 232-233, 235, 237-238, 240-241
                243, 245-246, 248-249, 251, 253-254, 256-257
                259, 261-262, 264-265, 267-269, 271, 275-277
                279-283, 285-289, 291-295, 297-301, 303-305
                307-311, 313-317, 319-323, 325-329, 331-335
                337-341, 343-345, 347-351, 354, 357-359
                362, 365-367, 370, 373-375, 378, 381-383
                386, 389-391, 394, 397, 399-403, 406, 409-411
                414, 417-419, 422, 425-427, 430, 433-435
                438, 441-443, 446, 449, 451-455, 458, 461-463
                466, 469-471, 474, 477-479, 482, 485-487
                490, 493-495, 498, 501, 503-507, 510, 513-515
                518, 521-523, 526, 529-531, 534, 537-539
                542, 545-547, 550, 553, 555-559, 562, 565-567
                570, 573-575, 578, 581-583, 586, 589-591
                594, 597-599, 602, 605, 607-611, 613-617
                619-623, 625-629, 631-635, 637-641, 643-645
                647-651, 653-657, 659-663, 665-669, 671-675
                677-681, 683-685, 687-691, 694, 697-699
                702, 705-707, 710, 713-715, 718, 721-723
                726, 729-731, 734, 737, 739-743, 746, 749-751
                754, 757-759, 762, 765-767, 770, 773-775
                778, 781-783, 786, 789, 791-795, 798, 801-803
                806, 809-811, 814, 817-819, 822, 825-827
                830, 833-835, 838, 841, 843-847, 850, 853-855
                858, 861-863, 866, 869-871, 874, 877-879
                882, 885-887, 890, 893, 895-899, 902, 905-907
                910, 913-915, 918, 921-923, 926, 929-931
                934, 937-939, 942, 945, 947-951, 953-957
                959-963, 965-969, 971-975, 977-981, 983-985
                987-991, 993-997, 999-1003, 1005-1009, 1011-1015
                1017-1021, 1023-1025, 1027-1031, 1034, 1037-1039
                1042, 1045-1047, 1050, 1053-1055, 1058
                1061-1063, 1066, 1069-1071, 1074, 1077
                1079-1083, 1086, 1089-1091, 1094, 1097-1099
                1102, 1105-1107, 1110, 1113-1115, 1118
                1121-1123, 1126, 1129, 1131-1135, 1138
                1141-1143, 1146, 1149-1151, 1154, 1157-1159
                1162, 1165-1167, 1170, 1173-1175, 1178
                1181, 1183-1187, 1190, 1193-1195, 1198
                1201-1203, 1206, 1209-1211, 1214, 1217-1219
                1222, 1225-1227, 1230, 1233, 1235-1239
                1242, 1245-1247, 1250, 1253-1255, 1258
                1261-1263, 1266, 1269-1271, 1274, 1277-1279
                1282, 1285, 1287-1291, 1293-1297, 1299-1303
                1305-1309, 1311-1315, 1317-1321, 1323-1325
                1327-1331, 1333-1337, 1339-1343, 1345-1349
                1351-1355, 1357-1361, 1363-1365, 1367-1371
                1374, 1377-1379, 1382, 1385-1387, 1390
                1393-1395, 1398, 1401-1403, 1406, 1409-1411
                1414, 1417, 1419-1423, 1426, 1429-1431
                1434, 1437-1439, 1442, 1445-1447, 1450
                1453-1455, 1458, 1461-1463, 1466, 1469
                1471-1475, 1478, 1481-1483, 1486, 1489-1491
                1494, 1497-1499, 1502, 1505-1507, 1510
                1513-1515, 1518, 1521, 1523-1527, 1530
                1533-1535, 1538, 1541-1543, 1546, 1549-1551
                1554, 1557-1559, 1562, 1565-1567, 1570
                1573, 1575-1579, 1582, 1585-1587, 1590
                1593-1595, 1598, 1601-1603, 1606, 1609-1611
                1614, 1617-1619, 1622, 1625, 1627-1631
                1633-1637, 1639-1643, 1645-1649, 1651-1655
                1657-1661, 1663-1665, 1667-1671, 1673-1677
                1679-1683, 1685-1689, 1691-1695, 1697-1701
                1703-1705, 1707-1711, 1714, 1717-1719, 1722
                1725-1727, 1730, 1733-1735, 1738, 1741-1743
                1746, 1749-1751, 1754, 1757, 1759-1763
                1766, 1769-1771, 1774, 1777-1779, 1782
                1785-1787, 1790, 1793-1795, 1798, 1801-1803
                1806, 1809, 1811-1815, 1818, 1821-1823
                1826, 1829-1831, 1834, 1837-1839, 1842
                1845-1847, 1850, 1853-1855, 1858, 1861
                1863-1867, 1870, 1873-1875, 1878, 1881-1883
                1886, 1889-1891, 1894, 1897-1899, 1902
                1905-1907, 1910, 1913, 1915-1919, 1922
                1925-1927, 1930, 1933-1935, 1938, 1941-1943
                1946, 1949-1951, 1954, 1957-1959, 1962
                1965, 1967-1971, 1973-1977, 1979-1983, 1985-1989
                1991-1995, 1997-2001, 2003-2005, 2007-2011
                2013-2017, 2019-2023, 2025-2029, 2031-2035
                2037-2041, 2043-2045, 2047-2049, 2052, 2054-2056
                2059, 2061-2063, 2066, 2068-2070, 2073
                2075-2077, 2080, 2082-2084, 2086-2088, 2090-2092
                2094-2096
/tmp/pjdfstest-run/tests/rename/12.t         (Wstat: 0 Tests: 32 Failed: 24)
  Failed tests:  8-31
/tmp/pjdfstest-run/tests/rename/13.t         (Wstat: 0 Tests: 32 Failed: 20)
  Failed tests:  7-8, 10-13, 15-18, 20-23, 25-28, 30-31
/tmp/pjdfstest-run/tests/rename/14.t         (Wstat: 0 Tests: 32 Failed: 20)
  Failed tests:  7-8, 10-13, 15-18, 20-23, 25-28, 30-31
/tmp/pjdfstest-run/tests/rename/20.t         (Wstat: 0 Tests: 25 Failed: 12)
  Failed tests:  6, 8-9, 11-12, 14-15, 17-18, 20-21, 23
/tmp/pjdfstest-run/tests/rename/23.t         (Wstat: 0 Tests: 42 Failed: 36)
  Failed tests:  5-7, 10-42
/tmp/pjdfstest-run/tests/rename/24.t         (Wstat: 0 Tests: 13 Failed: 2)
  Failed tests:  8-9
/tmp/pjdfstest-run/tests/rmdir/01.t          (Wstat: 0 Tests: 14 Failed: 6)
  Failed tests:  9-14
/tmp/pjdfstest-run/tests/rmdir/06.t          (Wstat: 0 Tests: 23 Failed: 19)
  Failed tests:  5-23
/tmp/pjdfstest-run/tests/symlink/00.t        (Wstat: 0 Tests: 14 Failed: 6)
  Failed tests:  9-14
/tmp/pjdfstest-run/tests/symlink/05.t        (Wstat: 0 Tests: 12 Failed: 2)
  Failed tests:  9-10
/tmp/pjdfstest-run/tests/symlink/06.t        (Wstat: 0 Tests: 12 Failed: 2)
  Failed tests:  9-10
/tmp/pjdfstest-run/tests/symlink/08.t        (Wstat: 0 Tests: 21 Failed: 12)
  Failed tests:  4, 6-7, 9-10, 12-13, 15-16, 18-19, 21
/tmp/pjdfstest-run/tests/truncate/00.t       (Wstat: 0 Tests: 21 Failed: 13)
  Failed tests:  8-20
/tmp/pjdfstest-run/tests/truncate/03.t       (Wstat: 0 Tests: 5 Failed: 4)
  Failed tests:  1-4
/tmp/pjdfstest-run/tests/unlink/00.t         (Wstat: 0 Tests: 112 Failed: 101)
  Failed tests:  6-8, 10-12, 14-16, 18-20, 22-24, 26-111
/tmp/pjdfstest-run/tests/unlink/03.t         (Wstat: 0 Tests: 4 Failed: 2)
  Failed tests:  1-2
/tmp/pjdfstest-run/tests/unlink/11.t         (Wstat: 0 Tests: 270 Failed: 188)
  Failed tests:  12-15, 18-21, 24-27, 30-33, 36-41, 43-48
                50-53, 56-59, 62-65, 68-71, 74-77, 80-85
                87-92, 94-97, 100-103, 106-109, 112-115
                118-121, 124-129, 131-136, 138-141, 144-147
                150-153, 156-159, 162-165, 168-173, 175-180
                182-185, 188-191, 194-197, 200-203, 206-209
                212-217, 219-224, 226-229, 232-235, 238-241
                244-247, 250-253, 256-261, 263-268
/tmp/pjdfstest-run/tests/unlink/14.t         (Wstat: 0 Tests: 7 Failed: 1)
  Failed test:  7
/tmp/pjdfstest-run/tests/utimensat/00.t      (Wstat: 0 Tests: 32 Failed: 25)
  Failed tests:  7-31
/tmp/pjdfstest-run/tests/utimensat/09.t      (Wstat: 0 Tests: 7 Failed: 1)
  Failed test:  5
Files=237, Tests=8789, 249 wallclock secs ( 1.64 usr  0.50 sys + 31.27 cusr 36.93 csys = 70.34 CPU)
Result: FAIL
